read_count,title,update_time
50,还有机会到29的，不急,04-14 11:23
60,比亏损股还差，前景是黄全,04-14 11:18
41,绿讯精密割尔股份高开割韭菜几年了就是这个熊样,04-14 11:22
37,我来了,04-14 11:21
62,预计这股收盘也就35左右,04-14 11:16
44,什么时候回到40放我走,04-14 11:21
64,要命啦！这量砸得不得了,04-14 10:36
44,周末还后悔没在里面的现在可以进了，倒车接你来了,04-14 11:21
43,一大批韭菜被套牢了,04-14 11:20
96,002475立讯精密25-4-14我于4-8发文对标的进行了预测，原文是：“1、,04-14 11:20
49,抄电子产品要看美国面色吃饭。,04-14 11:18
105,开盘买进来的憨憨们，你们是脑子缺爱吗？别人发酵什么你买什么。活该被割,04-14 11:15
59,早上要是听我的高开就跑，低位在接回来，大跌再买，别满仓，小仓位做差价，不至于被动,04-14 11:18
43,逆天,04-14 11:17
60,你就连装都不装了吗？,04-14 11:15
61,这b玩意什么时候能好起来,04-14 11:15
45,以后这辈子不要抄电子产品。,04-14 11:17
52,未来两年的高点今天已经出现了,04-14 11:16
40,继续发套,04-14 11:16
47,主力跑完了，散户也跑了,04-14 11:16
47,今天有谁追高了吗？看来还不如歌尔,04-14 11:16
46,今天是高开低走，卖出的机会,04-14 11:16
47,跑十几个亿没跌，散户太能接了,04-14 11:16
63,量化高度操盘,04-14 11:02
54,新增那么多融资盘和散户，能上去才怪，今天就是利好兑现……,04-14 11:15
43,18年1.0版本关税战， ，所以关税战小仓位快进快出，特别受此影响,04-14 11:15
249,高开低走，注意风险,04-13 07:51
53,没有封板拉回去，就回不去了，太多人抄到底了，基本就在这个位置玩了。,04-14 11:14
51,天呐一天500家机构，那一年不是18000家机构调研吗？招待费怎么办,04-14 11:14
43,跌如瀑布流水，涨如蜗牛爬行，这垃J股马上又绿了。,04-14 11:13
41,快跑快跑,04-14 11:12
341,家人们早上好！跟大家更新一下，今天早盘我把华蓝集团出了，收获了15个点，为这周开,04-14 10:25
482,周一高开高走要不要清仓做Ｔ,04-13 10:25
49,天量啊，埋了这么多的资金,04-14 11:11
52,你们说的韭菜就是我，服了,04-14 11:10
37,草,04-14 11:09
45,今天追进去的人不知道何年啊月,04-14 11:09
40,亏死了,04-14 11:08
60,开盘买进来的憨憨们，你们是脑子缺爱吗？别人发酵什么你买什么。活该被割,04-14 11:03
35,都盼着大涨一波,04-14 11:08
37,又流出呵呵,04-14 11:07
45,主力开盘笑死了，这么多人往里面冲,04-14 11:07
257,今天，微软旗下代码托管平台GitHub出现异常状况，所有中国IP地址因未知原因遭,04-13 11:40
76,消费电子 3.46%+无线耳机 3.02%+电子烟 3.01%+苹果概念 2.9,04-14 11:06
41,看细则:只对半导体电子产品里的美国产部分豁免，对其余部分一分钱也不免的!,04-14 11:06
38,主力跑，散户抬,04-14 11:06
35,果链全部高开低走，套人套路。,04-14 11:05
34,在这里躲牛市,04-14 11:05
36,真的有涨停买的吗,04-14 11:05
34,两个点，走啦，彻底走啦，承认自己能力不行，赔太多，越想翻本，亏损越多，赔就赔了，,04-14 11:05
29,大盘一跌不得哇哇叫,04-14 11:05
29,29元再向你招手,04-14 11:03
43,这个交易量能操盘的资金会是谁,04-14 11:03
34,比大盘弱这么多，真垃圾！,04-14 11:03
33,这是要干什么？,04-14 11:03
51,机构不卖的话，散户都能够把这个票拉上去。今天高开低走，说明机构出货明显。可能有没,04-14 11:02
32,这是来搞笑的吧,04-14 11:02
34,一群什么人在里，都是开矿的吗,04-14 11:02
45,开盘走了，谢谢庄家给机会我在33.88离场。关心国际税务纠纷变化，该休息一阵子了,04-14 10:58
32,利好就是冲高跑,04-14 11:01
81,东方精工可控核聚变业绩龙头,04-14 11:01
30,能摆上去谈的…不多,04-14 11:01
39,小韭菜们别幻想了,04-14 11:00
64,（卖在拉升）000582北部湾港减仓；兑现～点到为止,04-14 11:00
83,预测洗盘，本周3个涨停,04-14 10:37
37,有没有专业人士出来聊聊立讯这个家伙,04-14 10:59
46,利好出货我怎么就是吃不够教训呢,04-14 10:45
34,放天量了，尾盘止赢，落袋为安，看看下午如何,04-14 10:58
135,妈的追高了,04-14 09:42
36,坑爹概念股啊,04-14 10:57
30,走了太难玩了,04-14 10:56
39,还好没有入坑,04-14 10:56
41,还得有利好，老美也不想让苹果大亏,04-14 10:56
215,$立讯精密(SZ002475)$,04-11 03:53
41,感觉是买点,04-14 10:55
42,今天才是历史天量，逢高减仓，还会下来做底,04-14 10:55
36,上午主力净流出12亿！！,04-14 10:55
124,果然是周末买不到，周一卖不掉,04-14 09:00
33,横盘26-34,04-14 10:54
52,要涨起来了,04-14 10:50
51,那些说到四十的呢,04-14 10:50
21,骗炮的还没看明白吗？,04-14 10:53
67,什么情况？,04-14 10:25
34,最近肚子不舒服了，放个屁都票找个坑蹲着，就怕被慌报军情,04-14 10:53
7952,机构密集调研“对等关税”影响,04-13 05:32
37,大盘下来这股最少跌五个点,04-14 10:52
40,我说绿了吧。,04-14 10:45
74,这么大的利好，高开低走，盘中居然还绿了，32.17买了一成仓，试试水。,04-14 10:47
96,开盘等涨停的我此刻像个小丑,04-14 10:42
63,不买赢通，买了立讯！,04-14 10:37
57,以后的不看这些马路消息,04-14 10:36
69,暂避锋芒吧，是不是GJD的救市资金开始跑了，追高不适合，等绿了再买吧,04-14 10:33
120,男不成还要绿吗？,04-14 10:23
159,小作文害死人,04-14 10:19
83,32.19真的是天赐的买点，这股真的好操作。,04-14 10:16
106,美商务部长：电子产品“关税豁免”是暂时的半导体行业关税即将来袭！财联社1小时前约,04-14 10:14
59,稳住，我们能赢，开盘就买入，结果大面管饱,04-14 09:54
100,机构根本不看好，一群散户进去吃面,04-14 09:42
278,走啦，周五买的，今天集合竞价跑了，谢谢立讯，感谢立讯,04-14 09:34
411,你们都不看消息吗？美财政部长又说不考虑豁免了，还在往里面冲？,04-14 09:34
917,利好个嘚，仔细看清楚了，只有美国生产的零部件得豁免，中国制造的电子产品一样收12,04-12 10:24
38,这支票应该是领头羊！,04-14 10:49
31,开始了吗,04-14 10:48
32,建仓拉升,04-14 10:48
41,都没带脑子吗？都觉得你们这群散户会买我为啥不出货？那么票我非要买这个？啥时候关税,04-14 10:48
42,重大利好今天必须涨停,04-14 10:46
39,今天全部把那些不坚定人甩下车了，开始一字板向上拉伸,04-14 10:48
42,把工业富联卖了去相信你绿了,04-14 10:45
